{"$schema":"https://json-schema.org/draft/2020-12/schema","additionalProperties":false,"properties":{"build_configuration":{"type":"string"},"build_configuration_sha256":{"pattern":"^[0-9a-f]{64}$","type":"string"},"source_revision":{"pattern":"^[0-9a-f]{40}$","type":"string"},"source_hashes":{"additionalProperties":{"pattern":"^[0-9a-f]{64}$","type":"string"},"type":"object"},"compiler_mode":{"type":"string"},"environment":{"type":"string"},"schema":{"const":"graphx.fhss.phase5-test-attestation.v2"},"suites":{"items":{"additionalProperties":false,"properties":{"command_argv":{"items":{"type":"string"},"minItems":1,"type":"array"},"environment_sha256":{"pattern":"^[0-9a-f]{64}$","type":"string"},"executable_sha256":{"type":"string"},"exit_status":{"type":"integer"},"failed":{"minimum":0,"type":"integer"},"input_hashes":{"additionalProperties":{"pattern":"^[0-9a-f]{64}$","type":"string"},"type":"object"},"passed":{"minimum":0,"type":"integer"},"regression_test_ids":{"items":{"type":"string"},"type":"array"},"skip_disposition":{"type":"string"},"skipped":{"minimum":0,"type":"integer"},"status":{"enum":["PASS","FAIL"]},"stderr_sha256":{"pattern":"^[0-9a-f]{64}$","type":"string"},"stdout_sha256":{"pattern":"^[0-9a-f]{64}$","type":"string"},"stdout_summary":{"type":"string"},"suite_id":{"type":"string"}},"required":["suite_id","command_argv","exit_status","stdout_summary","stdout_sha256","stderr_sha256","executable_sha256","environment_sha256","input_hashes","passed","failed","skipped","skip_disposition","status","regression_test_ids"],"type":"object"},"type":"array"}},"required":["schema","compiler_mode","environment","source_revision","source_hashes","build_configuration","build_configuration_sha256","suites"],"title":"FHSS Phase 5 cryptographically bound test execution records","type":"object"}
