{
  "build_configuration": "build-ninja/ninja-debug/CMakeCache.txt",
  "build_configuration_sha256": "fd44c43673c5520e6a4c7ff9f13beeacf0753be76bff48a77ed3016e6fd5e15d",
  "compiler_mode": "AppleClang 21.0.0 -std=c++2c",
  "environment": "macOS host; native Metal device unavailable",
  "schema": "graphx.fhss.phase5-test-attestation.v2",
  "source_revision": "6530ac6d9700e3a09dec68b1274e01040e5abe98",
  "source_hashes": {"CMakeLists.txt":"0e5e87822c34d5a5219dc6a7bc1890a3ee03ba848d515f2fd3d6a81eaceaa862","docs/dsp/fhss_architecture.md":"b5f2ed69bc7f7d2354a65b1d15c77da33d27b1194d21bfc0314fa1588fea4cda","libdsp/include/dsp/fhss/FHSSCpsmDecoder.hpp":"eeea6d55cc2a03503e169d2710080f94793ef0d12107a95aad07c089bcf27fd3","libdsp/include/dsp/fhss/FHSSProductionCandidateChannelizerNode.hpp":"3ab9b0149b0d96c462e53a09cb6206fd440c488df565fa2840a6285481fb6445"},
  "suites": [
    {"command_argv":["python3","examples/DSP/test/test_fhss_phase5_qualification.py"],"environment_sha256":"c6a79d2c02e220f1961077378988cc69f9f3040b75a655c23734dd1d17f4acbe","executable_sha256":"runtime:python3","exit_status":0,"failed":0,"input_hashes":{"examples/DSP/test/test_fhss_phase5_qualification.py":"f906f839ec5ac46d9a874567c094d87d37a8594a9fda3fbfc37dfb1a2da5d030","examples/DSP/tools/fhss_phase5_qualify.py":"c9bf05cb8c9716d531445c180d8fec46429f8a50982494264c78dbb6833fc405"},"passed":60,"regression_test_ids":["P5.HashMismatchFails","P5.PathEscapeFails","P5.DanglingReferenceFails","P5.DuplicateIdFails","P5.SyntheticPromotionFails","P5.PhysicalCountsMustBeZero","P5.ProductionPromotionFails","P5.AmbiguousPassAbsent","P5.HistoricalBindings","phase5_governance"],"skip_disposition":"none","skipped":0,"status":"PASS","stderr_sha256":"e3b0c44298fc1c149afbf4c8996fb92427ae41e4649b934ca495991b7852b855","stdout_sha256":"e5ebe53b5b4731bd63481c7ad823a122d44a50cf8c28ef8dd638866e6e1200b0","stdout_summary":"60 passed, 0 failed, 0 skipped\n","suite_id":"fhss_phase5_qualification"},
    {"command_argv":["ctest","--test-dir","build-ninja/ninja-debug","--output-on-failure","-R","fhss_fixture_topology_generator|fhss_phase2_candidate_characterization_smoke|fhss_phase3_independent_analytical|fhss_phase3_actual_graph_smoke|fhss_phase4_recorded_infrastructure|fhss_phase5_qualification"],"environment_sha256":"c6a79d2c02e220f1961077378988cc69f9f3040b75a655c23734dd1d17f4acbe","executable_sha256":"runtime:ctest","exit_status":0,"failed":0,"input_hashes":{"examples/DSP/test/CMakeLists.txt":"5d3fc8964935ded0a1e1a8f11704a8fe7af9c166dfaffc7068d24d3085f6b376"},"passed":6,"regression_test_ids":["FHSS minimal receiver configuration tests","fhss_phase2_candidate_characterization_smoke","Phase 3 terminal isolated tests"],"skip_disposition":"none","skipped":0,"status":"PASS","stderr_sha256":"e3b0c44298fc1c149afbf4c8996fb92427ae41e4649b934ca495991b7852b855","stdout_sha256":"a6c5614f936bf0dc6566904ce426de1923a2c3c564a9dca40a2137dcb17cbc57","stdout_summary":"6 passed, 0 failed, 0 skipped\n","suite_id":"fhss_registered_phase1_5"},
    {"command_argv":["ctest","--test-dir","build-ninja/ninja-debug","--output-on-failure","-R","^fhss_phase3_independent_analytical$"],"environment_sha256":"c6a79d2c02e220f1961077378988cc69f9f3040b75a655c23734dd1d17f4acbe","executable_sha256":"runtime:ctest","exit_status":0,"failed":0,"input_hashes":{"examples/DSP/test/test_fhss_phase3_independent.py":"e91bc35ac074fca4ad2eb07d3656224d19a09a0d32565bacafcd441f1acd1e2b"},"passed":1,"regression_test_ids":["Phase 3 v7 collision matrix","channelizer circular-history unit regression","FHSS CPSM state/discontinuity isolated tests","qualification limitation disclosure","fhss_phase3_report_verify"],"skip_disposition":"none","skipped":0,"status":"PASS","stderr_sha256":"e3b0c44298fc1c149afbf4c8996fb92427ae41e4649b934ca495991b7852b855","stdout_sha256":"adb1e69807847d4220f468d0c706993bb8fd79bb0fbc8f02dadb0a112db75d78","stdout_summary":"1 passed, 0 failed, 0 skipped\n","suite_id":"fhss_phase3_independent_analytical"},
    {"command_argv":["ctest","--test-dir","build-ninja/ninja-debug","--output-on-failure","-R","^fhss_phase4_recorded_infrastructure$"],"environment_sha256":"c6a79d2c02e220f1961077378988cc69f9f3040b75a655c23734dd1d17f4acbe","executable_sha256":"runtime:ctest","exit_status":0,"failed":0,"input_hashes":{"examples/DSP/test/test_fhss_phase4_recorded.py":"adfadc0d1758bf8c177edfb4ae117ef63031f6381f2ed7f7767bf44fc7782c74"},"passed":1,"regression_test_ids":["test_fhss_phase4_recorded.py"],"skip_disposition":"none","skipped":0,"status":"PASS","stderr_sha256":"e3b0c44298fc1c149afbf4c8996fb92427ae41e4649b934ca495991b7852b855","stdout_sha256":"adb1e69807847d4220f468d0c706993bb8fd79bb0fbc8f02dadb0a112db75d78","stdout_summary":"1 passed, 0 failed, 0 skipped\n","suite_id":"fhss_phase4_recorded_infrastructure"},
    {"command_argv":["./build-ninja/ninja-debug/libdsp/test/test_libdsp_unit"],"environment_sha256":"c6a79d2c02e220f1961077378988cc69f9f3040b75a655c23734dd1d17f4acbe","executable_sha256":"2fe220f83a7a21ed262308fc62acdc640d00b024c5ff09b17bc1e1d93ba65d5f","exit_status":0,"failed":0,"input_hashes":{},"passed":169,"regression_test_ids":["EmptyTerminalCandidateBatchReachesSinkWithoutInventingPulseEvidence"],"skip_disposition":"five native-Metal tests skipped because no active Metal device was available; skips are not passes","skipped":5,"status":"PASS","stderr_sha256":"e3b0c44298fc1c149afbf4c8996fb92427ae41e4649b934ca495991b7852b855","stdout_sha256":"a6b0e794b5ca6c6ace3a4d3c4564c0ed2b5322748748b5c5b83462fe3a84d136","stdout_summary":"169 passed, 0 failed, 5 skipped\n","suite_id":"libdsp_unit"},
    {"command_argv":["./build-ninja/ninja-debug/examples/DSP/test/test_dsp_example_unit"],"environment_sha256":"c6a79d2c02e220f1961077378988cc69f9f3040b75a655c23734dd1d17f4acbe","executable_sha256":"dc0eab93abc21dd4c175316c810ec7bbaec19ff4f4fccbf3648bebffbc2cb8be","exit_status":0,"failed":0,"input_hashes":{},"passed":56,"regression_test_ids":[],"skip_disposition":"none","skipped":0,"status":"PASS","stderr_sha256":"e3b0c44298fc1c149afbf4c8996fb92427ae41e4649b934ca495991b7852b855","stdout_sha256":"4688764f2aa9d9c0a993aec2b6fb4ce92ef68a5e4386e3f1a8219473c8ae8e49","stdout_summary":"56 passed, 0 failed, 0 skipped\n","suite_id":"dsp_example_unit"}
  ]
}
